{
  "$schema": "../schemas/remote-adapter-claim-manifest.schema.json",
  "schema_id": "mdplace.remote-adapter-claim-manifest/v1",
  "manifest_id": "remote-adapter-claim:v1",
  "package_series": "mdplace-spec/v1",
  "release_version": "1.0.0",
  "validator_id": "mdplace.package-validator",
  "validator_version": "1.2.0",
  "rows": [
    {
      "id": "remote-adapter",
      "owner": "remote-adapter",
      "verdict": "pass",
      "evidence_digest": "c2c29f450da0bbd6cec87fff39804b104c8ea32dc86b16c9810e0260334534db",
      "evidence_material": [
        {
          "ordinal": 0,
          "label": "remote_material_001",
          "path": "contracts/remote-intelligence-adapter/profile.json",
          "sha256": "7f73de38e8ae88a14cd20d3ad992ac1ea47fa65397051739e17d53e10efc7fd1"
        },
        {
          "ordinal": 1,
          "label": "remote_material_002",
          "path": "contracts/remote-intelligence-adapter/credential-boundary-evidence.json",
          "sha256": "bd45d892a7b68d4bf47017a520b3d40b6b7c032eb200f892e3f5831124508103"
        },
        {
          "ordinal": 2,
          "label": "remote_material_003",
          "path": "conformance/evidence/remote-adapter-provider-disclosure.txt",
          "sha256": "71586ae0ebb20c0206d61fc6b95c36b452a0e8347360bc4fc044664648a40c9f"
        },
        {
          "ordinal": 3,
          "label": "remote_material_004",
          "path": "contracts/remote-intelligence-adapter/retention-evidence.json",
          "sha256": "3269abee9ef70c1c97892240a54ca8f3d50c7dcac00bcd611b6ceed2243f935d"
        },
        {
          "ordinal": 4,
          "label": "remote_material_005",
          "path": "contracts/remote-intelligence-adapter/fixture-manifest.json",
          "sha256": "6c25b07752f8aa8559fbda02c33fe93b1dcf5bea1c96498c86fdd595455f279a"
        },
        {
          "ordinal": 5,
          "label": "remote_material_006",
          "path": "conformance/evidence/remote-adapter-evidence.json",
          "sha256": "27546e03780d61b45ef3f3941122934478d28db042837656dfc19120fae63a86"
        },
        {
          "ordinal": 6,
          "label": "remote_material_007",
          "path": "conformance/scenarios/remote-intelligence-adapter/permitted-primary-exact-bytes.json",
          "sha256": "a95a0089c80077da10baa5bb35472df6f48e79a98b6ff637192402f715ac96c1"
        },
        {
          "ordinal": 7,
          "label": "remote_material_008",
          "path": "conformance/scenarios/remote-intelligence-adapter/permitted-retry-exact-bytes.json",
          "sha256": "9698959ba3462972a897e46895eb7eec5b2ed87b5d3d9aa3e5e76be9d6eeee00"
        },
        {
          "ordinal": 8,
          "label": "remote_material_009",
          "path": "conformance/scenarios/remote-intelligence-adapter/permitted-fallback-exact-bytes.json",
          "sha256": "52bc74e8e26781073bcf6e96891c04cb404a4192bda4d0f97d669272df1614bb"
        },
        {
          "ordinal": 9,
          "label": "remote_material_010",
          "path": "conformance/scenarios/remote-intelligence-adapter/exact-input-ceiling.json",
          "sha256": "7e23a883939711f5ea6844f80d53c7f75ef8e16ef24c3f1baf9f17b797ca0503"
        },
        {
          "ordinal": 10,
          "label": "remote_material_011",
          "path": "conformance/scenarios/remote-intelligence-adapter/exact-output-ceiling.json",
          "sha256": "cf43e67039d21f088630456d88117470a864f0d95788202b752983ee2e46437d"
        },
        {
          "ordinal": 11,
          "label": "remote_material_012",
          "path": "conformance/scenarios/remote-intelligence-adapter/exact-runtime-ceiling.json",
          "sha256": "c159de6aaef086656b61fcad0e1980b5b76b5e1d4914abd4774e80610d1e5951"
        },
        {
          "ordinal": 12,
          "label": "remote_material_013",
          "path": "conformance/scenarios/remote-intelligence-adapter/exact-cost-ceiling.json",
          "sha256": "dedc7d49f6b11e0d588f2be0ea3b5e8fc87d670146bbecb0ec05b95512615bd1"
        },
        {
          "ordinal": 13,
          "label": "remote_material_014",
          "path": "conformance/scenarios/remote-intelligence-adapter/exact-attempt-ceiling.json",
          "sha256": "ba42777af5e3174ad5e6ee618198839714114fcde3e3a202225d219fc4b5371a"
        },
        {
          "ordinal": 14,
          "label": "remote_material_015",
          "path": "conformance/scenarios/remote-intelligence-adapter/exact-retry-ceiling.json",
          "sha256": "3283c90b52d4ca4b1ead8218d19ac26f418b89cf0c78a5589a848c2874435086"
        },
        {
          "ordinal": 15,
          "label": "remote_material_016",
          "path": "conformance/scenarios/remote-intelligence-adapter/exact-fallback-ceiling.json",
          "sha256": "826475f80892d7d0a690a9616f10b6e84eecc0ce0ebd57bf86d1e4c234ea39ff"
        },
        {
          "ordinal": 16,
          "label": "remote_material_017",
          "path": "conformance/scenarios/remote-intelligence-adapter/missing-processing-envelope-denied.json",
          "sha256": "cff0d2e6235cb19ba2d6b4053aabdd763e8867a9a1997b0853e12d4288dbeb1b"
        },
        {
          "ordinal": 17,
          "label": "remote_material_018",
          "path": "conformance/scenarios/remote-intelligence-adapter/stale-policy-binding-denied.json",
          "sha256": "3330c7103b783206cf15d06ac679a85aa0f7aca12b5a4a95519f32b4f76d62ac"
        },
        {
          "ordinal": 18,
          "label": "remote_material_019",
          "path": "conformance/scenarios/remote-intelligence-adapter/malformed-processing-envelope-denied.json",
          "sha256": "ba743c724f4227ecfea21ac708187cc7361f0420662d647d662482deb50a71ca"
        },
        {
          "ordinal": 19,
          "label": "remote_material_020",
          "path": "conformance/scenarios/remote-intelligence-adapter/unsupported-provider-denied.json",
          "sha256": "794828f150a6a50c6ca6b6b372e0160c6f41bd8f1c5d6633eb09dc8fc7e0947e"
        },
        {
          "ordinal": 20,
          "label": "remote_material_021",
          "path": "conformance/scenarios/remote-intelligence-adapter/unauthorized-provider-denied.json",
          "sha256": "882cc208b851c7b035267513ada4740611f74fdede12d5f160625907eefc882c"
        },
        {
          "ordinal": 21,
          "label": "remote_material_022",
          "path": "conformance/scenarios/remote-intelligence-adapter/input-budget-exhausted.json",
          "sha256": "6e0c1e8a514257bae73100fcb460a2079e2492b30525dc8aa6332190523994f3"
        },
        {
          "ordinal": 22,
          "label": "remote_material_023",
          "path": "conformance/scenarios/remote-intelligence-adapter/output-budget-exhausted.json",
          "sha256": "fe6e9ed507ab09ac5e67bdfb7d78616b5dff9be94ea0843f60763dbf8bd55f9e"
        },
        {
          "ordinal": 23,
          "label": "remote_material_024",
          "path": "conformance/scenarios/remote-intelligence-adapter/runtime-budget-exhausted.json",
          "sha256": "b6080f1da254cfd2dbb3d9623d9729f983eee5503ff7f63e83969044effa3ed0"
        },
        {
          "ordinal": 24,
          "label": "remote_material_025",
          "path": "conformance/scenarios/remote-intelligence-adapter/cost-budget-exhausted.json",
          "sha256": "49b3acc2dbd02450c8c6b632faa87ae5c6a2e8857629c3efc887031e729c860c"
        },
        {
          "ordinal": 25,
          "label": "remote_material_026",
          "path": "conformance/scenarios/remote-intelligence-adapter/unapproved-destination-denied.json",
          "sha256": "72f738b70e412a6e4dfcc1abbdd89cb43cb20dd6266ed6170ce95205377014f2"
        },
        {
          "ordinal": 26,
          "label": "remote_material_027",
          "path": "conformance/scenarios/remote-intelligence-adapter/forbidden-retry-denied.json",
          "sha256": "3f2528dfa8dd5e0c1c84a47d3744fea3804f5a3b7858743c47a6798299fd310b"
        },
        {
          "ordinal": 27,
          "label": "remote_material_028",
          "path": "conformance/scenarios/remote-intelligence-adapter/forbidden-fallback-denied.json",
          "sha256": "b8b20c493e73c0dca86821873a6d8fbe0646e5e190633a77bf6cf9be57a7a267"
        },
        {
          "ordinal": 28,
          "label": "remote_material_029",
          "path": "conformance/scenarios/remote-intelligence-adapter/failed-credential-boundary-denied.json",
          "sha256": "b23a32908beb2e86d1539972752e023bb20d1bf299ee0b63317d56204379611a"
        },
        {
          "ordinal": 29,
          "label": "remote_material_030",
          "path": "conformance/scenarios/remote-intelligence-adapter/missing-credential-boundary-denied.json",
          "sha256": "7d57816fd3fc9f69ee8042be6538638a2531924b83b24bee1aae861b5e0c4a21"
        },
        {
          "ordinal": 30,
          "label": "remote_material_031",
          "path": "conformance/scenarios/remote-intelligence-adapter/stale-credential-boundary-denied.json",
          "sha256": "d3a65794404795e5672f02320ebeffbf6eea07b5d890da23a8240128c0651777"
        },
        {
          "ordinal": 31,
          "label": "remote_material_032",
          "path": "conformance/scenarios/remote-intelligence-adapter/malformed-credential-boundary-denied.json",
          "sha256": "1ee2a781a07fd399b9990f7ff0089bf4bb4ab796ac55a362b5f8834c5fc551f8"
        },
        {
          "ordinal": 32,
          "label": "remote_material_033",
          "path": "conformance/scenarios/remote-intelligence-adapter/unsupported-credential-boundary-denied.json",
          "sha256": "d9bf59efcf6f06ca8491ecc43401e1106745b2c14cb4fd1491ef1030a614c494"
        },
        {
          "ordinal": 33,
          "label": "remote_material_034",
          "path": "conformance/scenarios/remote-intelligence-adapter/missing-retention-evidence-denied.json",
          "sha256": "a825ad01aa6afc542eff1779b05cd67b3ab57eeacc1984180d691058e10975d6"
        },
        {
          "ordinal": 34,
          "label": "remote_material_035",